{
  "$schema": "https://json-schema.org/draft/2020-12/schema",
  "additionalProperties": false,
  "properties": {
    "description": {
      "maxLength": 2048,
      "minLength": 0,
      "type": "string"
    },
    "id": {
      "maxLength": 96,
      "minLength": 1,
      "pattern": "^[a-z][a-z0-9_-]*(?:\\.[a-z0-9_-]+)+$",
      "type": "string"
    },
    "kind": {
      "enum": [
        "mechanic_profile"
      ]
    },
    "name": {
      "maxLength": 100,
      "minLength": 1,
      "type": "string"
    },
    "profiles": {
      "additionalProperties": false,
      "properties": {
        "practice": {
          "items": {
            "additionalProperties": false,
            "properties": {
              "id": {
                "maxLength": 96,
                "minLength": 1,
                "pattern": "^[a-z][a-z0-9_]*$",
                "type": "string"
              },
              "version": {
                "maximum": 100000,
                "minimum": 1,
                "type": "integer"
              }
            },
            "required": [
              "id",
              "version"
            ],
            "type": "object"
          },
          "maxItems": 32,
          "minItems": 1,
          "type": "array"
        },
        "recovery": {
          "items": {
            "additionalProperties": false,
            "properties": {
              "id": {
                "maxLength": 96,
                "minLength": 1,
                "pattern": "^[a-z][a-z0-9_]*$",
                "type": "string"
              },
              "version": {
                "maximum": 100000,
                "minimum": 1,
                "type": "integer"
              }
            },
            "required": [
              "id",
              "version"
            ],
            "type": "object"
          },
          "maxItems": 32,
          "minItems": 1,
          "type": "array"
        },
        "strategy": {
          "items": {
            "additionalProperties": false,
            "properties": {
              "id": {
                "maxLength": 96,
                "minLength": 1,
                "pattern": "^[a-z][a-z0-9_]*$",
                "type": "string"
              },
              "version": {
                "maximum": 100000,
                "minimum": 1,
                "type": "integer"
              }
            },
            "required": [
              "id",
              "version"
            ],
            "type": "object"
          },
          "maxItems": 32,
          "minItems": 1,
          "type": "array"
        },
        "weather": {
          "items": {
            "additionalProperties": false,
            "properties": {
              "id": {
                "maxLength": 96,
                "minLength": 1,
                "pattern": "^[a-z][a-z0-9_]*$",
                "type": "string"
              },
              "version": {
                "maximum": 100000,
                "minimum": 1,
                "type": "integer"
              }
            },
            "required": [
              "id",
              "version"
            ],
            "type": "object"
          },
          "maxItems": 32,
          "minItems": 1,
          "type": "array"
        }
      },
      "required": [
        "strategy",
        "weather",
        "recovery",
        "practice"
      ],
      "type": "object"
    },
    "schema_version": {
      "enum": [
        1
      ]
    }
  },
  "required": [
    "kind",
    "schema_version",
    "id",
    "name",
    "description",
    "profiles"
  ],
  "title": "Motorsport Manager mechanic_profile v1",
  "type": "object"
}
