{
  "kind": "mechanic_profile",
  "schema_version": 1,
  "id": "core.mechanic_profile.default",
  "name": "Complete race weekend",
  "description": "Registered strategy, weather, recovery and practice providers with their compatible save-reader plans.",
  "profiles": {
    "strategy": [
      {
        "id": "strategy",
        "version": 1
      }
    ],
    "weather": [
      {
        "id": "strategy",
        "version": 1
      },
      {
        "id": "weather",
        "version": 1
      }
    ],
    "recovery": [
      {
        "id": "strategy",
        "version": 1
      },
      {
        "id": "weather",
        "version": 1
      },
      {
        "id": "recovery",
        "version": 1
      }
    ],
    "practice": [
      {
        "id": "strategy",
        "version": 1
      },
      {
        "id": "weather",
        "version": 1
      },
      {
        "id": "recovery",
        "version": 1
      },
      {
        "id": "practice",
        "version": 1
      }
    ]
  }
}
